{
  "format": "stasium.zone_index",
  "format_version": 1,
  "region": "stormspire",
  "start_zone": "stormspire_entry",
  "start": {
    "zone_id": "stormspire_entry",
    "x": 16,
    "y": 12
  },
  "max_climb_steps": -1,
  "movement": {
    "adjacency": "ortho"
  },
  "zones": [
    {
      "zone_id": "stormspire_entry",
      "file": "zones/stormspire_entry.json",
      "width": 32,
      "height": 24
    },
    {
      "zone_id": "stormspire_door",
      "file": "zones/stormspire_door.json",
      "width": 32,
      "height": 24
    }
  ]
}
